{
  "schema_version": 1,
  "policy_id": "vbuf.numerical-contracts",
  "policy_version": 1,
  "tolerance_profiles": {
    "qwen3.synthetic-av-absolute.v1": {
      "version": 1,
      "criteria": [
        {
          "metric": "max_absolute_error",
          "comparison": "less_than",
          "value": 0.001,
          "unit": "absolute",
          "required": true
        }
      ],
      "provenance": "Existing synthetic AV direct test shared ceiling; canonical packed AV historically uses strict max_abs < 1e-3. Native AV also retains its stricter 3e-6 assertion."
    },
    "qwen3.native-av-synthetic-strict.v1": {
      "version": 1,
      "criteria": [
        {
          "metric": "max_absolute_error",
          "comparison": "less_than",
          "value": 0.000003,
          "unit": "absolute",
          "required": true
        }
      ],
      "provenance": "Retains the existing strict native AV assertion (< 3e-6 absolute error) on the deterministic FP64-oracle direct-test fixtures only."
    },
    "qwen3.final-output.compatibility.v1": {
      "version": 1,
      "criteria": [
        {
          "metric": "relative_rms_error",
          "comparison": "less_equal",
          "value": 0.02,
          "unit": "fraction",
          "required": true
        },
        {
          "metric": "cosine_similarity",
          "comparison": "greater_equal",
          "value": 0.9998,
          "unit": "fraction",
          "required": true
        }
      ],
      "provenance": "Preserves the existing small-context Qwen canonical/native and cross-device gate: relative RMS <= 0.02 and cosine >= 0.9998. Not a universal tensor tolerance."
    }
  },
  "contracts": [
    {
      "contract_id": "qwen3.attention_av.fp64_operation_accuracy",
      "version": 1,
      "category": "OPERATION_ACCURACY",
      "operation": "attention_av",
      "reference": {
        "kind": "FP64_OPERATION_ORACLE",
        "identity": "fp64-qwen3-gqa-av-oracle-v1",
        "semantics": "Binary64 product and accumulation for each output, rounded once to F32; high precision, not exact real arithmetic."
      },
      "measurement_metrics": [
        "max_absolute_error",
        "mean_absolute_error",
        "rms_error",
        "relative_rms_error",
        "cosine_similarity",
        "finite_outputs",
        "bitwise_equality"
      ],
      "tolerance_profile": "qwen3.synthetic-av-absolute.v1",
      "required_invariants": [
        "same_shape",
        "finite_outputs",
        "logical_inputs_equivalent"
      ],
      "scope": {
        "model_identity": "synthetic:qwen3-gqa-40q-8kv-d128",
        "backend_family": "*",
        "implementation_identity": "*",
        "device_family": "*",
        "device_sm_versions": "*",
        "placement_identity": "*",
        "output_dtype": "F32",
        "input_dtype": ["F16", "F32"],
        "shapes": ["128x1x40", "128x32x40"],
        "capacity": {"minimum": 37, "maximum": 1032},
        "context_length": {"minimum": 1, "maximum": 1032},
        "rows": {"minimum": 1, "maximum": 32},
        "requires_logical_inputs_equivalent": true,
        "empirical_scope": "Deterministic synthetic Qwen3 GQA AV fixtures only; tested capacities 37, 64, 512, 1032 and rows 1/32. This is not a bound for arbitrary inputs."
      },
      "qualification_tests": ["vbuf_qwen3_native_attention_av_contract"],
      "status": "ACTIVE",
      "threshold_provenance": "The existing direct contract test requires native AV max absolute error < 3e-6 and canonical packed AV < 1e-3 on deterministic FP64-oracle fixtures. The shared 1e-3 strict ceiling is the already-enforced canonical ceiling and applies only to those fixtures; native is also checked against its stricter historical assertion. No model-level compatibility is implied."
    },
    {
      "contract_id": "qwen3.attention_av.native_fp64_synthetic_accuracy",
      "version": 1,
      "category": "OPERATION_ACCURACY",
      "operation": "attention_av",
      "reference": {
        "kind": "FP64_OPERATION_ORACLE",
        "identity": "fp64-qwen3-gqa-av-oracle-v1",
        "semantics": "Binary64 product and accumulation for each output, rounded once to F32; high precision, not exact real arithmetic."
      },
      "measurement_metrics": ["max_absolute_error", "finite_outputs"],
      "tolerance_profile": "qwen3.native-av-synthetic-strict.v1",
      "required_invariants": ["same_shape", "finite_outputs", "logical_inputs_equivalent"],
      "scope": {
        "model_identity": "synthetic:qwen3-gqa-40q-8kv-d128",
        "backend_family": "*",
        "implementation_identity": "ggml-native-layout-av",
        "device_family": "*",
        "device_sm_versions": "*",
        "placement_identity": "*",
        "output_dtype": "F32",
        "input_dtype": ["F16", "F32"],
        "shapes": ["128x1x40", "128x32x40"],
        "capacity": {"minimum": 37, "maximum": 1032},
        "context_length": {"minimum": 1, "maximum": 1032},
        "rows": {"minimum": 1, "maximum": 32},
        "requires_logical_inputs_equivalent": true,
        "empirical_scope": "Strict native AV error assertion on the deterministic synthetic direct-test fixtures only; not a worst-case bound."
      },
      "qualification_tests": ["vbuf_qwen3_native_attention_av_contract"],
      "status": "ACTIVE",
      "threshold_provenance": "Preserves the existing native AV direct-test ceiling max_abs < 3e-6 against the same FP64 oracle. The common operation contract separately preserves the canonical < 1e-3 ceiling."
    },
    {
      "contract_id": "qwen3.attention_av.packed_native.synthetic_compatibility",
      "version": 1,
      "category": "NUMERICAL_COMPATIBILITY",
      "operation": "attention_av",
      "reference": {
        "kind": "CANONICAL_EXECUTION",
        "identity": "packed-av-v1:",
        "semantics": "Canonical packed-V AV on the same V, probabilities, positions, and visible extent."
      },
      "measurement_metrics": ["max_absolute_error", "finite_outputs", "bitwise_equality"],
      "tolerance_profile": "qwen3.synthetic-av-absolute.v1",
      "required_invariants": ["same_shape", "finite_outputs", "logical_inputs_equivalent"],
      "scope": {
        "model_identity": "synthetic:qwen3-gqa-40q-8kv-d128",
        "backend_family": "*",
        "implementation_identity": "ggml-native-layout-av",
        "device_family": "*",
        "device_sm_versions": "*",
        "placement_identity": "*",
        "output_dtype": "F32",
        "input_dtype": ["F16", "F32"],
        "shapes": ["128x1x40", "128x32x40"],
        "capacity": {"minimum": 37, "maximum": 1032},
        "context_length": {"minimum": 1, "maximum": 1032},
        "rows": {"minimum": 1, "maximum": 32},
        "requires_logical_inputs_equivalent": true,
        "empirical_scope": "Canonical/native compatibility on deterministic synthetic AV direct-test inputs only; not full-model compatibility."
      },
      "qualification_tests": ["vbuf_qwen3_native_attention_av_contract"],
      "status": "ACTIVE",
      "threshold_provenance": "Preserves the direct-test native-versus-packed maximum absolute parity assertion < 1e-3, independently of FP64 mathematical accuracy."
    },
    {
      "contract_id": "qwen3.attention_av.fp64_model_boundary_observation",
      "version": 1,
      "category": "OPERATION_ACCURACY",
      "operation": "attention_av",
      "reference": {
        "kind": "FP64_OPERATION_ORACLE",
        "identity": "qwen3-av-boundary-fp64-oracle-v1",
        "semantics": "Binary64 accumulation from captured Qwen3 V and probabilities over the actual visible extent, rounded to F32."
      },
      "measurement_metrics": ["max_absolute_error", "rms_error", "relative_rms_error", "cosine_similarity", "finite_outputs", "bitwise_equality"],
      "required_invariants": ["same_shape", "finite_outputs", "logical_inputs_equivalent"],
      "scope": {
        "model_identity": "sha256:f409ec946faf59cb338647c47efc2f28e9bdec7e8bd33acacd0cd6a36f2eaa31",
        "backend_family": "GGML_CUDA",
        "implementation_identity": "ggml-native-layout-av",
        "device_family": "CUDA",
        "device_sm_versions": [86],
        "placement_identity": "multi:0x26,1x14;emb=0;norm=1;head=1",
        "output_dtype": "F32",
        "input_dtype": "F16",
        "shapes": ["128x1x40", "128x32x40"],
        "phases": ["decode", "prefill"],
        "execution_topologies": ["native-av-side-branch"],
        "fixture_identities": ["qwen3-native-av-prefill32-cap512-layer0", "qwen3-native-av-decode32-cap512-layer0"],
        "input_identities": ["*"],
        "token_sequence_identities": ["*"],
        "capacity": {"minimum": 512, "maximum": 512},
        "context_length": {"minimum": 32, "maximum": 33},
        "rows": {"minimum": 1, "maximum": 32},
        "requires_logical_inputs_equivalent": true,
        "empirical_scope": "Captured Qwen3-14B Q4_K_M layer-0 AV boundaries from the exact two-GPU 26/14 placement at capacity 512 and visible contexts 32/33. Metrics are replayed diagnostics and do not authorize model-output selection or establish a worst-case operation bound."
      },
      "qualification_tests": ["vbuf_qwen3_native_av_boundary_diagnostic", "vbuf_numerical_contract_evidence_replay"],
      "status": "NEEDS_CALIBRATION",
      "threshold_provenance": "The captured oracle metrics are preserved, but no model-input-independent threshold is approved. Historical metric replay remains diagnostic-only."
    },
    {
      "contract_id": "qwen3.final_hidden.canonical_compatibility",
      "version": 1,
      "category": "NUMERICAL_COMPATIBILITY",
      "operation": "final_hidden",
      "reference": {
        "kind": "CANONICAL_EXECUTION",
        "identity": "canonical-packed-v-v1:",
        "semantics": "Canonical packed-V execution on the same exact model artifact and equivalent logical token history."
      },
      "measurement_metrics": [
        "max_absolute_error",
        "mean_absolute_error",
        "rms_error",